,bookID,title,authors,average_rating,isbn,isbn13,language_code,num_pages,ratings_count,text_reviews_count,publication_date,publisher,Unnamed: 12,Unnamed: 13,Unnamed: 14
2271,8150,The American Years,Brian Boyd,4.33,691024715,9780691024714,eng,800,256,22,1/31/1993,,,,
2273,8153,The Luzhin Defense,Vladimir Nabokov/Michael Scammell,3.95,679727221,9780679727224,eng,256,7305,277,8/11/1990,Vintage,,,
2275,8162,The Ravenscar Dynasty (Ravenscar  #1),Barbara Taylor Bradford,3.63,312354606,9780312354602,en-US,484,1287,104,12/26/2006,,,,
2276,8174,Dark Birthright,Jeanne Treat/Jane Starr Weils,3.63,097216748X,9780972167482,eng,429,132,27,10/1/2006,,,,
2278,8196,Laura's Album: A Remembrance Scrapbook of Laura Ingalls Wilder,William   Anderson/Laura Ingalls Wilder,4.3,60278420,9780060278427,eng,80,746,48,10/13/1998,HarperCollins,,,
2281,8200,A Little House Traveler: Writings from Laura Ingalls Wilder's Journeys Across America,Laura Ingalls Wilder,4.13,60724919,9780060724917,eng,352,686,52,2/7/2006,HarperCollins,,,
2282,8202,Laura Ingalls Wilder: A Biography,William   Anderson,4.2,60885521,9780060885526,eng,256,4144,98,1/2/2007,HarperCollins,,,
2284,8204,The Laura Ingalls Wilder Country Cookbook,Laura Ingalls Wilder/William   Anderson,4.09,64461963,9780064461962,eng,160,234,18,10/1/1997,,,,
2287,8213,The Erotic Phenomenon,Jean-Luc Marion/Stephen E. Lewis,4.03,226505367,9780226505367,eng,248,75,12,11/15/2006,,,,
2288,8214,The Phenomenon of Life: Toward a Philosophical Biology,Hans Jonas/Lawrence Vogel/Eleonore Jonas,4.24,810117495,9780810117495,eng,304,92,9,2/28/2001,,,,
2291,8227,Winter Days in the Big Woods,Laura Ingalls Wilder/Renée Graef,4.28,64433730,9780064433730,eng,32,1538,59,9/15/1995,HarperCollins,,,
2293,8230,Winter on the Farm,Laura Ingalls Wilder/Renée Graef/Jody Wheeler,4.15,006440692X,9780064406925,eng,32,424,25,9/6/1997,,,,
2294,8233,Summertime in the Big Woods,Laura Ingalls Wilder/Renée Graef,4.18,64434974,9780064434973,eng,40,867,31,2/2/2000,HarperCollins,,,
2296,8246,Laura Ingalls Wilder's Fairy Poems,Laura Ingalls Wilder/Richard  Hull,3.99,385325339,9780385325332,eng,39,143,18,10/13/1998,,,,
2297,8247,Constructing the Little House: Gender  Culture  and Laura Ingalls Wilder,Ann Romines,3.7,1558491228,9781558491229,eng,304,35,5,11/21/1997,,,,
2301,8254,Christmas Stories (Little House Chapter Books: Laura  #10),Laura Ingalls Wilder/Renée Graef/Heather Henson,4.21,64420817,9780064420815,eng,80,66,7,10/6/1999,HarperCollins,,,
2302,8255,My Little House Crafts Book: 18 Projects from Laura Ingalls Wilder's,Carolyn Strom Collins/Christina Wyss Eriksson/Mary Collier,4.03,64462048,9780064462044,eng,64,59,6,3/21/1998,HarperCollins,,,
2303,8256,Christmas in the Big Woods,Laura Ingalls Wilder/Renée Graef,4.2,64434877,9780064434874,eng,32,2142,72,9/20/1997,HarperCollins,,,
2305,8285,A Little House Birthday,Laura Ingalls Wilder/Doris Ettlinger,4.14,006443494X,9780064434942,eng,40,453,17,9/5/1998,HarperCollins,,,
2306,8290,The Deer in the Wood,Laura Ingalls Wilder/Renée Graef,4.17,64434982,9780064434980,eng,32,324,23,1/16/1999,HarperCollins,,,
2308,8298,The Little House Cookbook: Frontier Foods from Laura Ingalls Wilder's Classic Stories,Barbara M. Walker/Garth Williams,4.15,64460908,9780064460903,eng,256,3375,91,9/7/1989,HarperCollins,,,
2312,8359,Flowers (Eyewitness Explorers),David Burnie,3.85,789422131,9780789422132,eng,64,8,2,9/15/1997,,,,
2314,8370,The Making Of Disney's Animal Kingdom Theme Park,Melody Malmberg/Walt Disney Company,4.32,786864028,9780786864027,eng,192,34,2,5/1/1998,,,,
2317,8428,Insects & Spiders,David Burnie,4.5,783548818,9780783548814,eng,64,4,0,5/24/1999,,,,
2318,8486,The Prophet of Yonwood,Jeanne DuPrau,3.27,375875263,9780375875267,eng,289,621,82,4/1/2006,,,,
2320,8492,Prophet,Frank E. Peretti,3.94,1581345267,9781581345261,en-US,416,12789,221,3/11/2004,,,,
2321,8494,Access the Power of Your Higher Self: Your Source of Inner Guidance and Spiritual Transformation (Pocket Guides to Practical Spirituality),Elizabeth Clare Prophet,4.21,922729360,9780922729364,en-GB,100,55,6,9/21/2017,,,,
2322,8495,Hailstones and Halibut Bones,Mary O'Neill/John Wallner,4.31,385410786,9780385410786,en-US,64,125,22,4/1/1990,,,,
2323,8499,The Second Sex,Simone de Beauvoir/H.M. Parshley/Margaret Crosland,4.12,1857151372,9781857151374,eng,848,47,6,3/18/1993,,,,
2326,8506,Thomas Jefferson (Oxford Portraits),R.B. Bernstein,4.01,195181301,9780195181302,eng,253,4245,133,9/15/2005,,,,
2327,8508,The Jefferson Bible: The Life and Morals of Jesus of Nazareth,Thomas Jefferson,3.82,1557091846,9781557091840,eng,103,1038,100,8/1/2006,,,,
2328,8510,Who Was Thomas Jefferson?,Dennis Brindell Fradin/Nancy Harrison/John   O'Brien,4.07,448431459,9780448431451,eng,103,692,80,7/28/2003,,,,
2329,8515,The Man Who Listens to Horses,Monty Roberts/Lucy Grealy/Lawrence Scanlan,4.12,034542705X,9780345427052,en-US,352,9963,206,11/28/1998,,,,
2330,8520,Under Orders (Sid Halley  #4),Dick Francis,3.87,399154000,9780399154003,eng,308,4119,252,10/1/2006,,,,
2331,8522,For Kicks,Dick Francis,4.0,425194981,9780425194980,eng,292,3062,94,2/3/2004,,,,
2332,8523,Forfeit,Dick Francis,3.94,425201910,9780425201916,eng,256,2538,63,4/5/2005,,,,
2333,8525,Dead Cert,Dick Francis,3.97,425194973,9780425194973,eng,277,4964,124,1/6/2004,,,,
2334,8528,Rat Race,Dick Francis,3.98,425210766,9780425210765,eng,304,2400,93,7/5/2006,,,,
2335,8529,Reflex,Dick Francis,4.07,425206955,9780425206959,eng,304,4675,129,10/4/2005,,,,
2336,8532,Decider,Dick Francis,3.99,042519938X,9780425199381,eng,341,3461,133,12/7/2004,,,,
2337,8533,Slay Ride,Dick Francis,3.82,425196739,9780425196731,en-US,288,2215,60,4/6/2004,,,,
2338,8536,Bonecrack,Dick Francis,4.0,425208850,9780425208854,eng,304,2910,84,6/6/2006,,,,
2340,8538,Break In (Kit Fielding  #1),Dick Francis,4.05,425199932,9780425199930,eng,320,3758,128,1/4/2005,,,,
2341,8540,Blood Sport,Dick Francis,3.89,425199169,9780425199169,eng,288,4600,113,11/2/2004,,,,
2342,8541,Straight,Dick Francis,4.05,042520846X,9780425208465,eng,320,3513,143,2/7/2006,,,,
2343,8542,10 lb Penalty,Dick Francis,3.9,042519745X,9780425197455,eng,320,3490,177,8/3/2004,,,,
2344,8544,Trial Run,Dick Francis,3.83,425199835,9780425199831,eng,272,2004,54,9/7/2004,,,,
2345,8545,Wild Horses,Dick Francis,3.91,425196747,9780425196748,eng,352,2935,154,5/4/2004,,,,
2346,8546,Field of Thirteen,Dick Francis,3.73,042519499X,9780425194997,eng,304,2053,85,3/2/2004,,,,
2349,8552,Bolt (Kit Fielding  #2),Dick Francis,4.04,425202887,9780425202883,eng,288,5043,121,5/3/2005,,,,
2350,8557,Come to Grief (Sid Halley  #3),Dick Francis,4.01,425207188,9780425207185,eng,384,3786,134,12/6/2005,,,,
2351,8559,Enquiry,Dick Francis,3.96,425197050,9780425197059,en-US,272,96,4,7/6/2004,,,,
2352,8568,Odds Against (Sid Halley  #1),Dick Francis,4.06,425198006,9780425198001,eng,288,3749,130,2/1/2005,,,,
2354,8574,Whip Hand (Sid Halley  #2),Dick Francis,4.1,425203549,9780425203545,eng,304,5108,143,6/7/2005,,,,
2359,8598,Eats  Shoots & Leaves: Why  Commas Really Do Make a Difference!,Lynne Truss/Bonnie Timmons,4.15,399244913,9780399244919,eng,32,1371,205,7/25/2006,,,,
2362,8627,Master and Commander (Aubrey/Maturin   #1),Patrick O'Brian,4.1,393325172,9780393325171,en-US,459,541,95,10/17/2003,,,,
2363,8628,The Making of Master and Commander: The Far Side of the World,Tom McGregor,3.97,393325539,9780393325539,eng,168,96,13,10/17/2003,,,,
2364,8630,The Ionian Mission (Aubrey/Maturin  #8),Patrick O'Brian/Simon Vance,4.32,786177837,9780786177837,eng,10,3659,80,10/1/2005,,,,
2367,8645,Stanley Park,Timothy  Taylor,3.57,1582432902,9781582432908,eng,436,1818,89,9/25/2003,,,,
2368,8646,Crow Lake,Mary Lawson,3.88,385337639,9780385337632,eng,324,14109,1591,1/13/2003,,,,
2371,8660,The Lost World (TV Tie-in),Arthur Conan Doyle/Philip Gooden,3.92,142002720,9780142002728,eng,224,18,4,9/3/2002,Penguin Books,,,
2380,8703,The Restaurant at the End of the Universe (The Hitchhiker's Guide to the Galaxy  #2),Douglas Adams/Martin  Freeman,4.22,739332074,9780739332078,eng,6,493,95,6/1/2006,,,,
2385,8713,Point to Point Navigation,Gore Vidal,3.7,385517211,9780385517218,eng,277,621,90,11/7/2006,,,,
2387,8715,Palimpsest,Gore Vidal,3.99,140260897,9780140260892,en-US,448,1485,94,9/1/1996,Penguin Books,,,
2388,8716,Lincoln,Gore Vidal,4.21,375708766,9780375708763,eng,672,7326,430,2/15/2000,Vintage,,,
2389,8722,Burr,Gore Vidal,4.07,375708731,9780375708732,eng,430,7265,526,2/15/2000,Vintage,,,
2390,8725,Comfort Me with Apples: More Adventures at the Table,Ruth Reichl,4.04,375758739,9780375758737,eng,302,17939,947,4/9/2002,,,,
2392,8737,The Last Temptation of Christ,Nikos Kazantzakis/Peter A. Bien,4.16,068485256X,9780684852560,eng,506,8966,454,3/1/1998,Simon  Schuster,,,
2393,8738,Her Last Temptation,Leslie Kelly,3.59,373692285,9780373692286,eng,207,112,5,5/31/2005,,,,
2394,8741,The Last Temptation (Tony Hill & Carol Jordan  #3),Val McDermid,4.01,312936915,9780312936914,eng,496,4991,271,3/1/2005,,,,
2397,8745,Desert Flower,Waris Dirie/Cathleen Miller,4.15,688172377,9780688172374,eng,240,11981,735,3/15/2011,,,,
2402,8765,I Feel Bad About My Neck: And Other Thoughts on Being a Woman,Nora Ephron,3.69,307264556,9780307264558,eng,137,38506,4719,8/1/2006,,,,
2403,8766,Feel the Fear . . . and Do It Anyway,Susan  Jeffers,4.03,345487427,9780345487421,eng,217,506,53,12/26/2006,,,,
2405,8768,Today I Feel Silly  Other Moods That Make My Day,Jamie Lee Curtis/Laura Cornell,4.16,60245603,9780060245603,en-US,40,4171,518,7/31/2007,HarperCollins,,,
2407,8771,When I Feel Angry,Nancy Cote/Cornelia Maude Spelman,3.98,807588970,9780807588970,eng,24,113,4,1/1/2000,,,,
2410,8797,The Story of a Seagull and the Cat Who Taught Her to Fly,Luis Sepúlveda/Chris Sheban/Margaret Sayers Peden,4.14,439401879,9780439401876,eng,128,5097,219,8/1/2006,,,,
2412,8801,The Burgess Bird Book for Children,Thornton W. Burgess/Louis Agassiz Fuertes,4.31,486428400,9780486428406,eng,260,1253,54,4/23/2003,,,,
2413,8804,The Burgess Animal Book for Children,Thornton W. Burgess/Louis Agassiz Fuertes,4.26,486437450,9780486437453,eng,275,478,30,9/10/2004,,,,
2414,8808,The Adventures of Jimmy Skunk,Thornton W. Burgess/Thea Kliros/Harrison Cady,4.14,486280233,9780486280233,eng,96,275,19,5/20/1994,,,,
2415,8809,The Wanting Seed,Anthony Burgess,3.71,393315088,9780393315080,en-US,288,5423,293,12/17/1996,,,,
2416,8810,A Clockwork Orange,Anthony Burgess/Blake Morrison,3.99,141182601,9780141182605,eng,159,5366,524,2/24/2000,,,,
2417,8811,A Clockwork Orange,Anthony Burgess,3.99,014027409X,9780140274097,eng,149,1422,124,9/3/1998,Penguin Books,,,
2421,8820,The Doctor is Sick,Anthony Burgess,3.62,393316025,9780393316025,eng,260,966,39,8/17/1997,,,,
2426,8848,Le Petit Prince,Antoine de Saint-Exupéry,4.31,2070513289,9782070513284,fre,123,366,19,2/1/2004,,,,
2427,8852,Macbeth,William Shakespeare,3.9,743477103,9780743477109,eng,249,592315,7791,7/1/2013,Simon  Schuster,,,
2428,8853,Macbeth,William Shakespeare/Alan Durband,3.9,812035712,9780812035711,eng,224,296,20,4/1/1985,,,,
2434,8862,A Year in the Life of William Shakespeare: 1599,James Shapiro,4.09,60088745,9780060088743,eng,333,2330,252,6/13/2006,,,,
2435,8865,Who Was William Shakespeare?,Celeste Davidson Mannis/John   O'Brien,4.05,448439042,9780448439044,eng,105,755,94,12/28/2006,,,,
2437,8879,Planet of the Apes: Colony,William T. Quick,3.62,60086211,9780060086213,eng,288,24,1,3/25/2003,,,,
2438,8880,Planet of the Apes  Volume 1: Old Gods,Ian Edginton,2.62,1569716684,9781569716687,eng,80,8,2,3/5/2002,,,,
2439,8881,Planet of the Apes: The Fall,William T. Quick,2.92,60086203,9780060086206,eng,288,53,2,6/4/2002,,,,
2440,8889,Return to the Planet of the Apes #2: Escape from Terror Lagoon,William Arrow,3.0,345251679,9780345251671,eng,0,10,2,4/12/1976,,,,
2441,8891,Return to the Planet of the Apes:  Visions from Nowhere,William Arrow,3.33,345251229,9780345251220,eng,183,12,1,6/1/1976,,,,
2445,8909,The War of the Worlds,H.G. Wells/Arthur C. Clarke,3.82,375759239,9780375759239,eng,192,196425,4549,3/12/2002,Modern Library,,,
2447,8915,A Short History of World War II,James L. Stokesbury,3.95,688085873,9780688085872,eng,416,472,41,1/1/1980,,,,
2448,8916,The Complete Science Fiction Treasury of H.G. Wells,H.G. Wells,4.14,517052253,9780517052259,eng,0,45,1,6/24/1987,,,,
2449,8917,Best Science Fiction Stories of H. G. Wells,H.G. Wells,3.84,486215318,9780486215310,eng,320,60,4,11/24/2011,,,,
2450,8919,The Invisible Man,H.G. Wells,3.64,439574277,9780439574273,eng,208,333,23,9/1/2004,,,,
2451,8921,The Hound of the Baskervilles,Arthur Conan Doyle/Anne Perry/Sidney Paget,4.11,451528018,9780451528018,eng,256,191128,4802,7/1/2001,Signet,,,
2452,8922,The Hound of the Baskervilles (Sherlock Holmes  #5),Arthur Conan Doyle/David Timson,4.11,9626343346,9789626343340,eng,5,135,20,3/30/2005,,,,
2453,8924,The Hound of the Baskervilles,Arthur Conan Doyle/Pam Smy,4.11,763630640,9780763630645,eng,272,66,7,8/22/2006,,,,
2454,8927,Sherlock Holmes and the Case of the Hound of the Baskervilles (Great Illustrated Classics),Malvina G. Vogel/Arthur Conan Doyle,4.51,1596792507,9781596792500,en-US,237,33,1,1/1/2005,,,,
2457,8951,The Lake of Souls (Cirque du Freak #10),Darren Shan,4.18,316016659,9780316016650,eng,272,18536,350,9/6/2006,,,,
2458,8953,Freak the Mighty (Freak The Mighty  #1),Rodman Philbrick,4.01,439286069,9780439286060,eng,169,41589,4153,6/1/2001,,,,
2459,8954,Word Freak: Heartbreak  Triumph  Genius  and Obsession in the World of Competitive Scrabble Players,Stefan Fatsis,3.82,142002267,9780142002261,eng,372,4748,597,7/30/2002,Penguin Books,,,
2460,8960,Vampire Mountain (Cirque Du Freak  #4),Darren Shan,4.16,316905747,9780316905749,eng,208,26461,587,9/1/2003,,,,
2461,8964,Jesus Freaks: Stories of Those Who Stood for Jesus  the Ultimate Jesus Freaks (Jesus Freaks  #1),D.C. Talk/The Voice of the Martyrs,4.21,1577780728,9781577780724,eng,383,19217,271,1/15/1999,,,,
2462,8967,Trials of Death (Cirque Du Freak  #5),Darren Shan,4.25,316000957,9780316000956,eng,202,24590,525,1/18/2008,,,,
2464,8971,Freaks of the Storm: From Flying Cows to Stealing Thunder: The World's Strangest True Weather Stories,Randy Cerveny,3.17,1560258012,9781560258018,eng,371,139,25,12/29/2006,,,,
2465,8974,Freak Show: Presenting Human Oddities for Amusement and Profit,Robert Bogdan,3.88,226063127,9780226063126,eng,336,210,18,5/15/1990,,,,
2466,8976,Live Like a Jesus Freak: Spend Today as If It Were Your Last,D.C. Talk,4.06,1577782089,9781577782087,eng,184,591,29,11/1/2001,,,,
2467,8978,Freaks!: How to Draw Fantastic Fantasy Creatures,Steve  Miller,4.06,823016625,9780823016624,eng,144,31,1,6/1/2004,,,,
2468,8988,Jesus Freaks,Andre Duza,3.69,976249871,9780976249870,eng,390,55,7,4/20/2006,,,,
2469,8991,Category: Freaks  Vol. 1 (Category: Freaks  #1),Sakurako Gokurakuin/Lindsey Johnston,3.55,1588993000,9781588993007,eng,184,112,9,7/1/2005,,,,
2470,9005,Hello Cruel World: 101 Alternatives to Suicide for Teens  Freaks  and Other Outlaws,Kate Bornstein/Sara Quin,4.03,1583227202,9781583227206,eng,234,1458,175,5/2/2006,,,,
2475,9014,The Long Walk,Richard Bachman/Stephen King,4.11,451196716,9780451196712,eng,370,94303,4453,4/1/1999,Signet,,,
2476,9018,Long Walk to Freedom: Autobiography of Nelson Mandela,Nelson Mandela/Kofi Annan/Danny Glover,4.33,1586216880,9781586216887,eng,6,79,16,12/1/2004,,,,
2477,9019,Navajo Long Walk,Nancy M. Armstrong/Paulette Livers-Lambert,3.45,1879373564,9781879373563,eng,128,56,11,7/1/1994,,,,
2480,9051,The Historian's Craft: Reflections on the Nature and Uses of History and the Techniques and Methods of Those Who Write It.,Marc Bloch/Peter Putnam/Joseph Reese Strayer,4.05,394705122,9780394705125,eng,224,977,71,3/12/1964,Vintage,,,
2481,9058,Charles Dickens as a Legal Historian,William Holdsworth,4.0,1886363064,9781886363069,eng,166,4,2,2/1/2010,,,,
2482,9060,The Progressive Historians: Turner  Beard  Parrington (Phoenix Book),Richard Hofstadter,3.89,226348180,9780226348186,eng,498,37,5,11/19/1979,,,,
2485,9073,See No Evil: The True Story of a Ground Soldier in the CIA's War on Terrorism,Robert B. Baer,3.93,140004684X,9781400046843,eng,320,4040,259,1/7/2003,,,,
2487,9083,Plants and Landscapes for Summer-Dry Climates of the San Francisco Bay Region,East Bay M. U. D. Staff/Nora Harlow/Jill M. Singleton/Barrie D. Coate/Kristine Sandoe,4.3,975323113,9780975323113,en-US,336,47,8,5/1/2004,,,,
2488,9099,In Focus: National Geographic Greatest Portraits,Leah Bendavid-Val/National Geographic Society,4.24,079227363X,9780792273639,eng,504,819,31,10/1/2004,,,,
2489,9100,Portrait Photographer's Handbook,Bill Hurter,3.62,1584281405,9781584281405,eng,128,16,1,9/28/2004,,,,
2493,9121,The Portrait of Dorian Gray,Oscar Wilde/Elizabeth  Gray,4.08,1842161903,9781842161906,eng,51,85,2,10/10/1999,,,,
2494,9122,The Picture of Dorian Gray,Oscar Wilde/Donald L. Lawler,4.08,393955680,9780393955682,eng,462,171,13,1/1/1988,,,,
2495,9124,The Picture of Dorian Gray,Oscar Wilde/Michael Gillespie,4.08,393927547,9780393927542,en-US,517,663,52,8/1/2006,,,,
2496,9125,The Picture of Dorian Gray,Oscar Wilde/Joseph Bristow,4.08,192807293,9780192807298,eng,229,1089,78,11/1/2006,,,,
2497,9132,An Arab-Syrian Gentleman and Warrior in the Period of the Crusades: Memoirs of Usamah Ibn-Munqidh,Usamah ibn Munqidh/Philip Khuri Hitti/Richard W. Bulliet,3.95,231121253,9780231121255,eng,265,68,6,6/22/2000,,,,
2498,9140,Technical Manual and Dictionary of Classical Ballet,Gail Grant,4.38,486218430,9780486218434,eng,176,393,27,6/1/1982,,,,
2500,9143,Ballet Class,John         Green/Caroline Denzler,3.77,486296385,9780486296388,en-US,48,13,0,7/2/1997,,,,
2501,9144,NYC Ballet Workout,Peter Martins/Paul Kolnik/Richard Corman/Howard  Kaplan,4.01,688152023,9780688152024,eng,208,238,10,1/13/1997,,,,
2503,9149,Lara's Leap of Faith (The Royal Ballet School Diaries  #2),Alexandra Moss/Veronica Bennett,4.07,448435365,9780448435367,eng,144,155,14,1/13/2005,,,,
2504,9151,Isabelle's Perfect Performance (The Royal Ballet School Diaries  #3),Alexandra Moss,4.06,448437694,9780448437699,eng,144,130,4,5/5/2005,,,,
2506,9155,Boys or Ballet? (Royal Ballet School Diaries  #8),Alexandra Moss,3.92,448442515,9780448442518,eng,144,93,8,8/3/2006,,,,
2511,9186,Angelina's Ballet Class,Katharine Holabird/Helen Craig,3.88,044844013X,9780448440132,eng,24,73,1,1/19/2006,,,,
2513,9216,Ballet and Modern Dance,Susan Au,3.74,500203520,9780500203521,eng,224,53,6,6/17/2002,,,,
2514,9223,Teaching Classical Ballet,John               White,4.47,081301395X,9780813013954,eng,200,15,1,4/20/1996,,,,
2515,9236,Drat! We're Rats! (Scrambled Legs  #1),Jahnna N. Malcolm,3.69,970016409,9780970016409,eng,160,41,2,9/1/2000,,,,
2516,9245,Battle of the Bunheads (Scrambled Legs  #2),Jahnna N. Malcolm,3.5,970016417,9780970016416,eng,160,44,3,9/1/2000,,,,
2521,9298,Last Chance Saloon,Marian Keyes,3.81,60086246,9780060086244,en-US,528,35784,686,5/27/2003,,,,
2524,9301,Rachel's Holiday (Walsh Family  #2),Marian Keyes,3.95,60090383,9780060090388,eng,578,55525,1223,1/23/2007,,,,
2525,9303,Lucy Sullivan Is Getting Married,Marian Keyes,3.77,60090375,9780060090371,en-US,640,43077,690,1/23/2007,,,,
2526,9304,Essays and Stories by Marian Keyes: Bags  Trips  Make-up Tips  Charity  Glory  and the Darker Side of the Story,Marian Keyes,3.82,60787031,9780060787035,eng,368,1625,42,9/6/2005,,,,
2527,9305,No Dress Rehearsal,Marian Keyes,3.29,1902602323,9781902602325,eng,79,780,52,12/1/2000,,,,
2531,9330,The House of the Spirits,Isabel Allende/Madga Bogin/Christopher Hitchens,4.23,1400043182,9781400043187,eng,488,270,49,4/19/2005,,,,
2532,9337,"How To Meditate: An Anthology Of Talks On Meditation And ""Meditation: The Bridge Is Flowing But The River Is Not""",Frederick P. Lenz,0.0,1932206108,9781932206104,eng,228,0,0,1/1/2004,,,,
2533,9338,Insights: Talks On The Nature Of Existence,Frederick P. Lenz,0.0,1932206086,9781932206081,eng,304,0,0,1/1/2003,,,,
2534,9345,Palestine: Peace Not Apartheid,Jimmy Carter,3.82,743285026,9780743285025,eng,288,2864,349,11/30/2006,,,,
2535,9346,Our Endangered Values: America's Moral Crisis,Jimmy Carter,3.88,743285018,9780743285018,eng,224,3193,236,9/26/2006,Simon  Schuster,,,
2536,9347,An Hour Before Daylight: Memories of a Rural Boyhood,Jimmy Carter,3.91,743211995,9780743211994,eng,288,1935,229,10/16/2001,Simon  Schuster,,,
2537,9349,The Real Jimmy Carter: How Our Worst Ex-President Undermines American Foreign Policy  Coddles Dictators and Created the Party of Clinton and Kerry,Steven F. Hayward,3.32,895260905,9780895260901,eng,272,33,4,3/19/2004,,,,
2538,9350,The Virtues of Aging,Jimmy Carter,3.55,345425928,9780345425928,eng,160,221,36,10/13/1998,,,,
2539,9351,Living Faith,Jimmy Carter,3.8,812930347,9780812930344,eng,288,481,33,9/14/1998,,,,
2540,9352,Sharing Good Times,Jimmy Carter,3.47,743270681,9780743270687,eng,192,238,35,11/7/2005,Simon  Schuster,,,
2541,9355,Until I Find You,John Irving,3.63,345479726,9780345479723,eng,820,22547,1371,5/30/2006,,,,
2544,9363,Atlas Shrugged,Ayn Rand,3.69,451171926,9780451171924,eng,1074,912,128,3/3/1992,Signet,,,
2547,9376,Fannie Flagg's Original Whistle Stop Cafe Cookbook,Fannie Flagg,4.19,449910288,9780449910283,eng,224,911,42,9/11/1995,,,,
2549,9409,The Sari Shop,Rupa Bajwa,3.44,039332690X,9780393326901,eng,224,1858,153,6/17/2005,,,,
2550,9416,Confessions of a Shopaholic (Shopaholic  #1),Sophie Kinsella,3.64,440241413,9780440241416,eng,368,603675,10079,11/4/2003,,,,
2551,9417,Shopaholic and Sister (Shopaholic  #4),Sophie Kinsella,3.66,044024191X,9780440241911,eng,388,76205,1867,11/28/2006,,,,
2552,9418,Shopaholic Takes Manhattan (Shopaholic  #2),Sophie Kinsella,3.76,440241812,9780440241812,eng,387,100796,2382,12/27/2004,,,,
2553,9419,Shopaholic Ties the Knot (Shopaholic  #3),Sophie Kinsella,3.78,440241898,9780440241898,eng,407,94917,2089,8/31/2004,,,,
2555,9423,The Secret Dreamworld of a Shopaholic (Shopaholic  #1),Sophie Kinsella,3.64,552998877,9780552998871,eng,320,2214,249,9/14/2000,,,,
2556,9427,The Story of Chicago May,Nuala O'Faolain,3.24,1573223204,9781573223201,en-US,307,344,59,10/1/2005,,,,
2557,9431,Chicago Stories,James T. Farrell/Charles Fanning,3.89,252019814,9780252019814,en-US,296,38,5,6/1/1998,,,,
2559,9438,The Basic Works of Aristotle,Aristotle/Richard Peter McKeon/C.D.C. Reeve,4.24,375757996,9780375757990,eng,1487,2174,51,8/19/2009,,,,
2560,9439,Fear and Trembling and The Sickness Unto Death,Søren Kierkegaard/Walter Lowrie,4.1,691019622,9780691019628,eng,420,519,36,11/21/1968,,,,
2561,9442,Selections from Don Quixote - Selecciones de Don Quijote de la Mancha,Miguel de Cervantes Saavedra/Stanley Appelbaum,3.34,486406660,9780486406664,mul,288,26,0,12/23/1998,,,,
2563,9454,Hegel's Phenomenology of Spirit,Georg Wilhelm Friedrich Hegel/A.V. Miller/John Niemeyer Findlay,3.93,198245971,9780198245971,eng,640,13920,248,11/30/1976,,,,
2564,9456,Preface to the Phenomenology of Spirit,Georg Wilhelm Friedrich Hegel/Yirmiyahu Yovel,4.06,691120528,9780691120522,eng,223,110,16,1/17/2005,,,,
2565,9457,Hegel's Phenomenology of Spirit,Martin Heidegger/Kenneth Maly/Parvis Emad,4.18,253209102,9780253209108,eng,176,117,3,8/1/1988,,,,
2566,9462,Plato: Complete Works,Plato/John M. Cooper/Benjamin Jowett/Dorothea Frede/Alexander Nehamas/Paul Woodruff/Anthony Kenny/Rosamond Kent Sprague/Nicholas D. Smith/Karen Bell/D.S. Hutchinson/Donald J. Zeyl/Francisco J. González/Diskin Clay/Malcolm Schofield/Glenn R. Morrow/Jonathan Barnes/G.M.A. Grube/Brad Inwood/Mark Joyal/Jackson P. Hershbell/J.M. Edmonds/C.D.C. Reeve/Myles Burnyeat/Nicholas P. White/Mary Louise Gill/C.J. Rowe/Stanley Lombardo/David Gallop/Jeffrey Mitscherling/Richard D. McKiharan Jr./Andrew S. Becker/Mark Reuter/M.J. Levett/Paul        Ryan,4.35,872203492,9780872203495,eng,1838,9284,133,5/1/1997,,,,
2567,9464,A Guided Tour of 5 Works by Plato: Euthyphro/Apology/Crito/Phaedo/Cave,Christopher Biffle/Plato,4.33,1559343567,9781559343565,eng,125,9,1,12/28/1995,,,,
2569,9479,The Midnight Mystery (The Boxcar Children  #95),Gertrude Chandler Warner,3.9,080755538X,9780807555385,eng,128,312,9,1/1/2003,,,,
2570,9484,Within a Budding Grove (In Search of Lost Time  #2),Marcel Proust/C.K. Scott Moncrieff/Terence Kilmartin/D.J. Enright,4.4,375752196,9780375752193,eng,749,1032,162,11/3/1998,Modern Library,,,
2573,9489,Devil's Embrace (Devil  #1),Catherine Coulter,3.8,451200268,9780451200266,eng,397,3381,116,5/1/2000,Signet,,,
2574,9490,The Book of Embraces,Eduardo Galeano/Cedric Belfrage/Mark Schafer,4.3,393308553,9780393308556,eng,288,2221,165,4/17/1992,,,,
2575,9491,Experiencing Father's Embrace,Jack Frost,4.33,768423481,9780768423488,eng,256,545,44,4/1/2006,,,,
2576,9493,A Time to Embrace: Same-Gender Relationships in Religion  Law  and Politics,William Stacy Johnson,4.21,080282966X,9780802829665,en-US,330,44,10,11/1/2006,,,,
2577,9497,Memory's Embrace (Corbins  #3),Linda Lael Miller,4.19,671737694,9780671737696,eng,320,407,18,6/1/1991,Pocket Books,,,
2578,9498,Beauty: The Invisible Embrace,John O'Donohue,4.47,60957263,9780060957261,en-US,261,678,78,3/1/2005,,,,
2579,9501,Embrace,Mark Behr,3.8,349113009,9780349113005,eng,726,72,5,2/1/2001,,,,
2580,9503,Saving Fish from Drowning,Amy Tan,3.43,034546401X,9780345464019,eng,472,26762,2524,9/26/2006,,,,
2581,9506,Un Lugar Llamado Nada,Amy Tan/Claudia Conde,3.43,840806701X,9788408067016,spa,475,98,6,8/30/2006,,,,
2582,9507,Virginia Woolf: An Inner Life,Julia Briggs,4.15,156032295,9780156032292,eng,544,635,21,11/6/2006,Mariner Books,,,
2583,9512,Measure for Measure,William Shakespeare,3.68,014101380X,9780141013800,eng,224,58,5,10/27/2005,,,,
2584,9515,Henry Adams and the Making of America,Garry Wills,3.79,618134301,9780618134304,en-US,480,95,20,9/14/2005,,,,
2593,9538,Shadow Dance (Buchanan-Renard  #6),Julie Garwood,4.0,345453867,9780345453860,eng,336,11205,431,12/26/2006,,,,
2594,9539,The Shadow Rising (The Wheel of Time  #4),Robert Jordan,4.24,812513738,9780812513738,eng,1007,148074,2471,10/15/1993,,,,
2602,9557,Sputnik Sweetheart,Haruki Murakami/Philip Gabriel,3.83,99448475,9780099448471,eng,229,78434,3464,10/3/2002,Vintage,,,
